irn|ColObjectNumber|ColDepartment|ColCollection|ColSubCollection|SpeNumberSpecimens|ClaObjectName_tab|ColOtherName|ColPhysicalDescription|NarNarrative|GeoName|MinHeyNumber|MinChemClass|PetAssociated|GeoAge|GeoRock|ColSum|ColCollectionDates|LocalSum|LocalPrecise|SpeForm|DimHeight|DimLength|DimWidth|DimDepth|DimLengthUnit|PhyColour|ConHazard|MulDescription|NumMulFiles
501303|NEWUM : 2425|Natural Sciences|Earth Sciences|Mineralogy|1|mineral||Polished.||Quartz Chalcedony Carnelian|7.8.1||||||||||||||||||1
499895|NEWUM : 1015|Natural Sciences|Earth Sciences|Mineralogy|1|mineral||Quartz Rose||Quartz Rose|7.8.1||||||||||||||||||1
499915|NEWUM : 1035|Natural Sciences|Earth Sciences|Mineralogy|1|mineral||Quartz||Quartz|7.8.1||||||||||||||||||1
499918|NEWUM : 1038|Natural Sciences|Earth Sciences|Mineralogy|1|mineral||Babel lown habit.||Quartz|7.8.1|||||||UK, England, Cornwall|||||||||||1
499978|NEWUM : 1099|Natural Sciences|Earth Sciences|Mineralogy|1|mineral||Quartz||Quartz|7.8.1||Hematite||||||||||||||||1
499924|NEWUM : 1044|Natural Sciences|Earth Sciences|Mineralogy|1|mineral||Quartz Smoky||Quartz Smoky|7.8.1|||||||Europe, Switzerland, Amrsery|||||||||||1
499881|NEWUM : 1001|Natural Sciences|Earth Sciences|Mineralogy|1|mineral||Quartz||Quartz|7.8.1||Chalcopyrite||||||||||||||||1
499884|NEWUM : 1004|Natural Sciences|Earth Sciences|Mineralogy|1|mineral||Quartz||Quartz|7.8.1||||||||||||||||||1
499902|NEWUM : 1022|Natural Sciences|Earth Sciences|Mineralogy|1|mineral||Quartz, Rock Crystal.  Doubly terminated crystal.||Quartz Rock Crystal|7.8.1||||||||||||||||||1
499979|NEWUM : 1100|Natural Sciences|Earth Sciences|Mineralogy|1|mineral||Quartz||Quartz|7.8.1||||||||||||||||||1
503075|NEWUM : 4199|Natural Sciences|Earth Sciences|Mineralogy|1|mineral||Gypsum||Gypsum|25.4.3||||||||||||||||||1
505242|NEWUM : 6388|Natural Sciences|Earth Sciences|Mineralogy|1|mineral||Gypsum Alabaster||Gypsum Alabaster|25.4.3|||||||Europe, Italy|||||||||||1
505185|NEWUM : 6331|Natural Sciences|Earth Sciences|Mineralogy|1|mineral||Gypsum||Gypsum|25.4.3||||Middle Purbeck Beds|||UK, England, Dorset, Swanage, Pevene Point|||||||||||1
505249|NEWUM : 6395|Natural Sciences|Earth Sciences|Mineralogy|1|mineral||Gypsum Alabaster||Gypsum Alabaster|25.4.3||||||||||||||||||1
505873|NEWUM : 7056|Natural Sciences|Earth Sciences|Mineralogy|1|mineral||Tabular and tetragonal crystals.||Wulfenite|27.3.3||||||||||||||||||1
114439|NEWHM : M049.32|Natural Sciences|Earth Sciences|Mineralogy|1|mineral||Mineral specimen of Opal associated with Quartz Chalcedony Jasper (?). Collected from Nicolaevsk, Altai, U.S.S.R. Collected by Tsar Nicholas I.||Opal|07.08.08||Quartz Chalcedony Jasper (?)|||Tsar Nicholas I||U.S.S.R., Altai, Nicolaevsk||||10.7|9.2|7.5|cm|red|||1
114618|NEWHM : M051.11|Natural Sciences|Earth Sciences|Mineralogy|1|mineral||Mineral specimen of Quartz Chalcedony Agate. Collected from Nertschinsk, Siberia, U.S.S.R. Collected by Tsar Nicholas I.||Quartz Chalcedony Agate|07.08.01|||||Tsar Nicholas I||U.S.S.R., Siberia, Nertschinsk||||3.5|11.5|3.2|cm||||1
505204|NEWUM : 6350|Natural Sciences|Earth Sciences|Mineralogy|1|mineral||Gypsum||Gypsum|25.4.3||||||||||||||||||1
505309|NEWUM : 6455|Natural Sciences|Earth Sciences|Mineralogy|1|mineral||Gypsum||Gypsum|25.4.3||||||||||||||||||1
505329|NEWUM : 6475|Natural Sciences|Earth Sciences|Mineralogy|1|mineral||Gypsum||Gypsum|25.4.3||||||||||||||||||1
506253|NEWUM : 7437|Natural Sciences|Earth Sciences|Mineralogy|1|mineral||Gypsum||Gypsum|25.4.3|||||||Hutton Hill|Whiteadder||||||||||1
505260|NEWUM : 6406|Natural Sciences|Earth Sciences|Mineralogy|1|mineral||Fibrous.||Gypsum Satin Spar|25.4.3|||||Allan, Dr||Nottingham|||||||||||1
113949|NEWHM : M044.41|Natural Sciences|Earth Sciences|Mineralogy|1|mineral||Mineral specimen of Limonite. Collected from Beresowsk Mine, Catherineburg, U.S.S.R. Collected by Tsar Nicholas I.||Limonite|07.20.09|||||Tsar Nicholas I||U.S.S.R., Catherineburg|Beresowsk Mine|stalactitic||12.1|9|6.9|cm||||2
109899|NEWHM : M003.48|Natural Sciences|Earth Sciences|Mineralogy|1|mineral||Mineral specimen of Kyanite, with Staurolite and Biotite in mica schist. Collected from St. Gotthard, Switzerland (?). Collected by John Jeffrey.  nb-the label in the photo does not belong to this specimen.||Kyanite|15.02||Staurolite, Staurolite|||Jeffrey, John||Switzerland (?), St. Gotthard|||||||||||1
111876|NEWHM : M023.39|Natural Sciences|Earth Sciences|Mineralogy|1|mineral||Mineral specimen of Topaz associated with Beryl. Collected from Mount Adoun-Aschelon, Catherinbourg, U.S.S.R. Collected by Tsar Nicholas I.|Topaz is a relatively hard mineral, and a popular gemstone. Yellow and orange stones are fairly common, but the sought after pink topaz is often produced by heat treating yellow stones. Fine crystals of topaz are not uncommon, they are usually long and striated. Topaz is often found in granitic rocks, important sources include Brazil and the Ural Mountains. Closer to home, it occurs in Cornwall and the Mourne Mountains of Northern Ireland.|Topaz|17.02.01||Beryl|||Tsar Nicholas I||U.S.S.R., Catherinbourg, Mount Adoun-Aschelon||||15.4|8.3|5.9|cm||||1
510556|NEWHM : 2009.H1501|Natural Sciences|Earth Sciences|Mineralogy|1|mineral||Aquamarine crystal||Beryl Aquamarine|16.6.1|||||||||||3.4|2.6|2.2|cm||||4
111664|NEWHM : M021.27|Natural Sciences|Earth Sciences|Mineralogy|1|mineral||Mineral specimen of Beryl associated with Granite, Feldspar. Collected from Ilmen Mountains, U.S.S.R. Collected by Tsar Nicholas I.||Beryl|16.06.01||Granite|||Tsar Nicholas I||U.S.S.R., Ilmen Mountains||||14.6|8.3|6.9|cm||||3
111585|NEWHM : M020.48|Natural Sciences|Earth Sciences|Mineralogy|1|mineral||Mineral specimen of Vesuvianite. Collected from Zlatoust, Siberia, U.S.S.R. Collected by Tsar Nicholas I.||Vesuvianite|16.23.12|||||Tsar Nicholas I||U.S.S.R., Siberia, Zlatoust||granular massive||10.2|6.9|6.8|cm|clear|||3
77287|NEWHM : 2003.H2502|Natural Sciences|Earth Sciences|Mineralogy|1|mineral|fossil insect|Flies, preserved in amber.||Amber||||Caenozoic (?)||||no locality data|||||||||||2
108745|NEWHM : 1995.H1759|Natural Sciences|Earth Sciences|Mineralogy|5|mineral||Mineral specimen of Opal, Cherry Opal. Collected from Valenciana Mine, Guanahuato, Mexico. Collected by Rachel Mrs Todd, 19th March 1994.||Opal, Cherry Opal|07.08.08|||||Todd, Mrs Rachel|19/03/1994|Mexico, Guanahuato|||||||||||2
108746|NEWHM : 1995.H1761|Natural Sciences|Earth Sciences|Mineralogy|115|mineral||Mineral specimen of Quartz Chalcedony Agate of Quartz Chalcedony Jasper and Quartz Chalcedony Heliotrope. Collected by Dr Charlton, 13th August 1981.||Quartz Chalcedony Agate|07.08.01|| Quartz Chalcedony Heliotrope|||Charlton, Dr|13/08/1981||||||||||||1
108751|NEWHM : 1995.H1895|Natural Sciences|Earth Sciences|Mineralogy|1|mineral||Mineral specimen of Baryte Desert-Rose of Sandstone.|Desert rose is the name given to flower-like arrangements of groups of flat crystals. They are frequently found in hot dry desert environments.|Baryte Desert-Rose|25.04.14||Sandstone||Sandstone||||||||||||||1
108844|NEWHM : 2002.H4001|Natural Sciences|Earth Sciences|Mineralogy||mineral||Mineral specimen of Quartz Citrine.|Citrine is the yellow semi precious variety of quartz, which gets its colour from iron impurities. Citrine is sometimes set in jewellery, but it was more popular as a gemstone during Victorian times.|Quartz Citrine|07.08.01||||||||||||||||||1
108845|NEWHM : 2002.H4002|Natural Sciences|Earth Sciences|Mineralogy|1|mineral||Mineral specimen of Malachite.|Malachite is a green mineral. It gets its colour from copper (it is a carbonate of copper), and fizzes when tested with a drop of dilute hydrochloric acid. Malachite is an opaque (the opposite of transparent) mineral, and often has a distinctive pattern of concentric banding. Malachite is relatively soft, and is often carved into ornaments. It is also a popular semi precious gemstone. Malachite is found in many localities, including Zaire, Australia, Russia and the USA.|Malachite|11.02.01|||||||||botryoidal|9|15||8|cm||||1
108846|NEWHM : 2002.H4003|Natural Sciences|Earth Sciences|Mineralogy||mineral||Mineral specimen of Quartz Amethyst. Collected from Dauphine, France. Collected by N. Cookson.|Amethyst is the purple variety of quartz. The purple colour is caused by the presence of iron. Amethyst is a common gem-material. The Ancient Egyptains carved beads and scarabs from this mineral.|Quartz Amethyst|07.08.01|||||Cookson, N.||Europe, France, Dauphine|||6|9.5||4.5|cm||||1
108847|NEWHM : 2002.H4004|Natural Sciences|Earth Sciences|Mineralogy||mineral||Mineral specimen of Tourmaline group.|Tourmaline is a semi precious gemstone that occurs in a wide range of colours. This particular type, with a red core and a green outer layer is commonly described as watermelon tourmaline, for obvious reasons. Tourmaline is widely used in jewellery. This mineral is strongly pleochroic, which means that it appears to be differently coloured when viewed along different crystal axes (different directions), a property which helps to distinguish it from the many other gemstones with which it may be confused.|Tourmaline group|17.05.21|||||||||section (of large triangular crystal)||||||magenta|||2
108848|NEWHM : 2002.H4005|Natural Sciences|Earth Sciences|Mineralogy|2|mineral||Mineral specimen of Beryl Aquamarine associated with Quartz Smoky. Collected from U.S.S.R. Collected by Tsar Nicholas I. Hexagonal crystal in a block of Smoky Quartz.|Aquamarine is the blue to green variety of the mineral beryl, a silicate of beryllium and aluminium. The difference between green aquamarines and emerald (also a variety of beryl) is that emeralds are classified (in the UK), as stones deriving their colour from the element chromium. Aquamarines are popular gemstones, but are often treated to improve their colour. Aquamarine crystals are six sided (hexagonal) and can grow to very large sizes.|Beryl Aquamarine|16.06.01||Quartz Smoky|||Tsar Nicholas I|1838|U.S.S.R.|||||||||||3
108849|NEWHM : 2002.H4006|Natural Sciences|Earth Sciences|Mineralogy|1|mineral||Mineral specimen of Rhodonite. Collected from U.S.S.R.|Rhodonite takes its name from the Greek word rodon, which means rose, in allusion to the pink colour of this mineral. Rhodonite contains managanese, and is commonly found with ores of manganese and iron. Crystals of rhodonite are rare, and it it is usually opaque. Rhodonite is a popular decorative stone, and is often carved to make ornaments.|Rhodonite|14.17.01|||||||U.S.S.R.|||||||||||2
108850|NEWHM : 2002.H4007|Natural Sciences|Earth Sciences|Mineralogy|1|mineral|Lapis lazuli|Mineral specimen of Lazurite (lapis-lazuli). Collected from Lake Baikal, Irkutsk, USSR.|Lazurite is the blue coloured mineral that gives lapis lazuli its colour. Lapis lazuli is actually a rock, being made up of several minerals, including calcite and iron pyrite, which gives it its gold coloured flecks. Lapis lazuli was highly prized by the ancient Egyptians. The only known source of this material in the ancient world was in Afghanistan, so the Egyptians used artifical materials like blue glass (in the funeral mask of Tutankhamun), and 'Egyptian blue' for their wall paintings and coffins, as substitutes for this rare commodity.|Lazurite|17.09.02|||||||U.S.S.R., Irkutsk, Lake Baikal|||||||||||3
108851|NEWHM : 2002.H4008|Natural Sciences|Earth Sciences|Mineralogy||mineral||Mineral specimen of Millerite. Collected from Coldberry Gutter, Newbiggin, Co Durham (NE England). Collected by S.G. McLean.|Millerite is similar to iron pyrite (iron sulphide), but contains nickel too. It is also known as hair pyrite, because it often forms long, very thin hair like crystals. Millerite is a common mineral in nodules of clay ironstone in the South Wales coalfield. Other occurrences include Ontario, Canada, and Pennsylvania, USA.|Millerite|03.11.01|||||McLean, S. G.||UK, England, Co. Durham (NE England), Newbiggin, Coldberry Gutter|||||||||||1
108859|NEWHM : 2003.H2809|Natural Sciences|Earth Sciences|Mineralogy|1|mineral||Mineral specimen of Edenite associated with Zoisite, Corundum Ruby. Collected from Namaqualand, South Africa. Collected by Gray (?).||Edenite|||Zoisite|||Gray (?)||South Africa, Namaqualand|||||||||||2
108872|NEWHM : 2003.H2822|Natural Sciences|Earth Sciences|Mineralogy|1|mineral||Mineral specimen of Fluorite. Collected from Weardale, Co Durham (NE England). Collected by Gray (?).||Fluorite|8.4.7|||||Gray (?)||UK, England, Co. Durham (NE England), Weardale||crystal||120|80|55|mm|green (emerald)|||2
108904|NEWHM : 2003.H2873|Natural Sciences|Earth Sciences|Mineralogy|1|mineral||Mineral specimen of Fluorite. Collected from Frosterley Mine, Weardale, Co Durham (NE England). Collected by Frank Bell.||Fluorite|8.4.7|||||Bell, Frank||UK, England, Co. Durham (NE England), Weardale|Frosterley Mine|||155|85|75|mm||||1
109031|NEWHM : 2004.H2039|Natural Sciences|Earth Sciences|Mineralogy|1|mineral||Mineral specimen of Fluorite associated with Quartz, Limonite (after Ankerite) and Galena. Collected from unspecified rocks from Rampgill Mine, Nenthead, Cumbria (NW England). Collected by T.F. Bridges, 2003.||Fluorite|8.4.7||Quartz, Quartz|||Bridges, T. F.|2003|UK, England, Cumbria (NW England), Nenthead|Rampgill Mine||||||||||1
109035|NEWHM : 2004.H2043|Natural Sciences|Earth Sciences|Mineralogy|1|mineral||Mineral specimen of Sphalerite. Collected from unspecified rocks from Nentberry Haggs Mine, Nenthead, Cumbria (NW England). Collected by Helen Wilkinson and Barry Smith, 1996.||Sphalerite|3.4.4|||||Wilkinson, Helen|1996|UK, England, Cumbria (NW England), Nenthead|Nentberry Haggs Mine||||||||||3
109038|NEWHM : 2004.H2046|Natural Sciences|Earth Sciences|Mineralogy|1|mineral||Mineral specimen of Quartz associated with Sphalerite. Collected from unspecified rocks from Rampgill Mine, Nenthead, Cumbria (NW England). Collected by Helen Wilkinson and Barry Smith, 2002.||Quartz|7.8.1||Quartz|||Wilkinson, Helen|2002|UK, England, Cumbria (NW England), Nenthead|Rampgill Mine||||||||||1
109122|NEWHM : 2005.H427|Natural Sciences|Earth Sciences|Mineralogy|1|mineral||Mineral specimen of Chrysocolla. Collected from unspecified rocks from Westernhope Mine, Weardale, Co Durham (NE England). Collected by T.F. Bridges, 1988.||Chrysocolla|14.2.5|silicate||||Bridges, T. F.|1988|UK, England, Co. Durham (NE England), Weardale|Westernhope Mine||||||||||1
109123|NEWHM : 2005.H428|Natural Sciences|Earth Sciences|Mineralogy|1|mineral||Mineral specimen of Nickeline. Collected from unspecified rocks from Hilton Mine, Appleby, Cumbria (NW England). Collected by T.F. Bridges, 1977.||Nickeline|3.11.27|arsenide||||Bridges, T. F.|1977|UK, England, Cumbria (NW England), Appleby|Dow Scar Level, Hilton Mine, NGR : F14 NY 763226||||||||||1
109124|NEWHM : 2005.H429|Natural Sciences|Earth Sciences|Mineralogy|1|mineral||Mineral specimen of Annabergite. Collected from unspecified rocks from Hilton Mine, Appleby, Cumbria (NW England). Collected by T.F. Bridges, 1978.||Annabergite|20.10.9|arsenate||||Bridges, T. F.|1978|UK, England, Cumbria (NW England), Appleby|Hilton Mine||||||||||1
109125|NEWHM : 2005.H430|Natural Sciences|Earth Sciences|Mineralogy|1|mineral||Mineral specimen of Gersdorffite associated with Nickeline. Collected from unspecified rocks from Hilton Mine, Appleby, Cumbria (NW England). Collected by T.F. Bridges, 1978.||Gersdorffite|3.11.34|sulphide|Nickeline|||Bridges, T. F.|1978|UK, England, Cumbria (NW England), Appleby|Hilton Mine||||||||||1
109126|NEWHM : 2005.H431|Natural Sciences|Earth Sciences|Mineralogy|1|mineral||Mineral specimen of Nickeline associated with Annabergite and Galena (minor). Collected from unspecified rocks from Hilton Mine, Appleby, Cumbria (NW England). Collected by T.F. Bridges, 1988.||Nickeline|3.11.27|arsenide|Annabergite|||Bridges, T. F.|1988|UK, England, Cumbria (NW England), Appleby|Hilton Mine||||||||||1
109127|NEWHM : 2005.H432|Natural Sciences|Earth Sciences|Mineralogy|1|mineral||Mineral specimen of Melanterite. Collected from unspecified rocks from Smallcleugh Mine, Nenthead, Cumbria (NW England). Collected by T.F. Bridges, 2004.||Melanterite|25.10.5|sulphate||||Bridges, T. F.|2004|UK, England, Cumbria (NW England), Nenthead|Hetherington's Crawl, Smallcleugh Mine||||||||||1
109282|NEWHM : 2005.H1680|Natural Sciences|Earth Sciences|Mineralogy|2|mineral||Mineral specimen of Amber. Collected from unspecified rocks.||Amber||fossil resin||||||||||50|50|30|mm||||1
109286|NEWHM : 2005.H1684|Natural Sciences|Earth Sciences|Mineralogy|2|mineral||Mineral specimen of Amber. Collected from unspecified rocks.||Amber||fossil resin|||||||||||||||||1
109289|NEWHM : 2005.H1687|Natural Sciences|Earth Sciences|Mineralogy|1|mineral||Mineral specimen of Resin. Collected from unspecified rocks. Contains spider.||Resin|||||||||||||||||||1
109333|NEWHM : 2005.H1821|Natural Sciences|Earth Sciences|Mineralogy|1|model, mineral||Model specimen. Crystallographic model. Isometric/cubic crystal system. One of a set.||||||||||||cube|||||||||1
109334|NEWHM : 2005.H1819|Natural Sciences|Earth Sciences|Mineralogy|1|model, mineral||Model specimen. Crystallographic model. Isometric/cubic crystal system. One of a set.||||||||||||cube (modified by octahedron)|||||||||1
109335|NEWHM : 2005.H1820|Natural Sciences|Earth Sciences|Mineralogy|1|model, mineral||Model specimen. Crystallographic model. Isometric/cubic crystal system. One of a set.||||||||||||octahedron (modified by cube)|||||||||1
109336|NEWHM : 2005.H1821|Natural Sciences|Earth Sciences|Mineralogy|1|model, mineral||Model specimen. Crystallographic model. Isometric/cubic crystal system. One of a set.||||||||||||dodecahedron (rhombic) & dodecahedron|||||||||1
109337|NEWHM : 2005.H1822|Natural Sciences|Earth Sciences|Mineralogy|1|model, mineral||Model specimen. Crystallographic model. Isometric/cubic crystal system. One of a set.||||||||||||octahedron (modified by rhombic dodecahedron/dodecahedron)|||||||||1
109338|NEWHM : 2005.H1823|Natural Sciences|Earth Sciences|Mineralogy|1|model, mineral||Model specimen. Crystallographic model. Isometric/cubic crystal system. One of a set.||||||||||||pyritohedron/dihexahedron|||||||||1
109339|NEWHM : 2005.H1824|Natural Sciences|Earth Sciences|Mineralogy|1|model, mineral||Model specimen. Crystallographic model. Isometric/cubic crystal system. One of a set.||||||||||||trapezohedron/tetragon-trioctahedron|||||||||1
109340|NEWHM : 2005.H1825|Natural Sciences|Earth Sciences|Mineralogy|1|model, mineral||Model specimen. Crystallographic model. Isometric/cubic crystal system. One of a set.||||||||||||trisoctahedron/trigon-trioctahedron|||||||||1
109341|NEWHM : 2005.H1826|Natural Sciences|Earth Sciences|Mineralogy|1|model, mineral||Model specimen. Crystallographic model. Isometric/cubic crystal system. One of a set.||||||||||||tetrahexahedron|||||||||1
109342|NEWHM : 2005.H1827|Natural Sciences|Earth Sciences|Mineralogy|1|mineral, model||Model specimen. Crystallographic model. Isometric/cubic crystal system. One of a set.||||||||||||diploid/didodecahedron|||||||||1
109343|NEWHM : 2005.H1828|Natural Sciences|Earth Sciences|Mineralogy|1|model, mineral||Model specimen. Crystallographic model. Isometric/cubic crystal system. Deltoid dodecahedron/tetragon-tritetrahedron. One of a set.|||||||||||||||||||||1
109344|NEWHM : 2005.H1829|Natural Sciences|Earth Sciences|Mineralogy|1|model, mineral||Model specimen. Crystallographic model. Tetragonal crystal system. One of a set.||||||||||||prism (010) & pinacoid (001)|||||||||1
109345|NEWHM : 2005.H1830|Natural Sciences|Earth Sciences|Mineralogy|1|model, mineral||Model specimen. Crystallographic model. Tetragonal crystal system. One of a set.||||||||||||prism (010) & bipyramid|||||||||1
109346|NEWHM : 2005.H1831|Natural Sciences|Earth Sciences|Mineralogy|1|model, mineral||Model specimen. Crystallographic model. Orthorhombic crystal system. One of a set.||||||||||||crystallographic|||||||||1
109347|NEWHM : 2005.H1832|Natural Sciences|Earth Sciences|Mineralogy|1|model, mineral||Model specimen. Crystallographic model. Tetragonal crystal system. One of a set.||||||||||||ditetragonal prism & pinacoid|||||||||1
109348|NEWHM : 2005.H1833|Natural Sciences|Earth Sciences|Mineralogy|1|model, mineral||Model specimen. Crystallographic model. Hexagonal crystal system. One of a set.||||||||||||prism (hexagonal) & pinacoid|||||||||1
109349|NEWHM : 2005.H1834|Natural Sciences|Earth Sciences|Mineralogy|1|model, mineral||Model specimen. Crystallographic model. Hexagonal crystal system. One of a set.||||||||||||prism (hexagonal) & bipyramid|||||||||1
109350|NEWHM : 2005.H1835|Natural Sciences|Earth Sciences|Mineralogy|1|model, mineral||Model specimen. Crystallographic model. Hexagonal crystal system. One of a set.||||||||||||dihexagonal prism & pinacoid|||||||||1
109351|NEWHM : 2005.H1836|Natural Sciences|Earth Sciences|Mineralogy|1|model, mineral||Model specimen. Crystallographic model. Hexagonal crystal system. One of a set.||||||||||||bipyramid (hexagonal)|||||||||1
109352|NEWHM : 2005.H1837|Natural Sciences|Earth Sciences|Mineralogy|1|model, mineral||Model specimen. Crystallographic model. Hexagonal crystal system. One of a set.||||||||||||hexagonal scalenohedron|||||||||1
109353|NEWHM : 2005.H1838|Natural Sciences|Earth Sciences|Mineralogy|1|model, mineral||Model specimen. Crystallographic model. Orthorhombical crystal system. One of a set.||||||||||||crystallographic|||||||||1
109354|NEWHM : 2005.H1839|Natural Sciences|Earth Sciences|Mineralogy|1|model, mineral||Model specimen. Crystallographic model. Tetragonal crystal system. One of a set.||||||||||||bipyramid (tetragonal)|||||||||1
109355|NEWHM : 2005.H1840|Natural Sciences|Earth Sciences|Mineralogy|1|model, mineral||Model specimen. Crystallographic model. One of a set.||||||||||||rhombohedron|||||||||1
109356|NEWHM : 2005.H1841|Natural Sciences|Earth Sciences|Mineralogy|1|model, mineral||Model specimen. Crystallographic model. One of a set.||||||||||||rhombohedron|||||||||1
109357|NEWHM : 2005.H1842|Natural Sciences|Earth Sciences|Mineralogy|1|model, mineral||Model specimen. Crystallographic model. One of a set.||||||||||||crystallographic|||||||||1
109358|NEWHM : 2005.H1843|Natural Sciences|Earth Sciences|Mineralogy|1|model, mineral||Model specimen. Crystallographic model. One of a set.||||||||||||crystallographic|||||||||1
109390|NEWHM : 2005.H1875|Natural Sciences|Earth Sciences|Mineralogy|1|mineral||Mineral specimen of Gold. In Quartz. Collected from unspecified rocks from Zimbabwe. Collected by Major Spain, 1916.||Gold|1.5|element|Quartz|||Spain, Major|1916|Africa, Zimbabwe|||||||||||1
109458|NEWHM : 2005.H2244|Natural Sciences|Earth Sciences|Mineralogy|1|mineral||Mineral specimen of Corundum. Collected from unspecified rocks from Rubh'a'chromain Sill, Corsaig, Mull (Scotland). Collected by Brian Young, August 1994. Small deep crystals in aluminous xenolith.||Corundum|7.6.1|oxide||||Young, Brian|1994-08-|UK, Scotland, Mull (Scotland), Corsaig, Rubh'a'chromain Sill||||50|40|40|mm|blue|||1
109463|NEWHM : 2005.H2249|Natural Sciences|Earth Sciences|Mineralogy|1|mineral||Mineral specimen of Linarite. Collected from unspecified rocks from Drypry Mine, Wolsingham, Co Durham (NE England). Collected by Brian Young, 1991.||Linarite|25.7.6|sulphate||||Young, Brian|1991|UK, England, Co. Durham (NE England), Wolsingham|Drypry Mine|||70|55|45|mm||||1
109473|NEWHM : 2005.H2259|Natural Sciences|Earth Sciences|Mineralogy|11|mineral||Mineral specimen of Beryl (?). Collected from unspecified rocks.  Abbs collection.||Beryl (?)|16.6.1|silicate||||||||fragments (hexagonal)||||||green (dark)|||1
109494|NEWHM : 2005.H2311|Natural Sciences|Earth Sciences|Mineralogy|2|mineral||Mineral specimen of Fluorite. Collected from unspecified rocks from Rogerley Quarry, Frosterley, Co Durham (NE England).||Fluorite|8.4.7|fluoride||||||UK, England, Co. Durham (NE England), Frosterley|Rogerley Quarry|||30|30|30|mm|green (emerald)|||3
109495|NEWHM : 2005.H2312|Natural Sciences|Earth Sciences|Mineralogy|1|mineral||Mineral specimen of Fluorite and Calcite. Collected from unspecified rocks.||Fluorite|8.4.7|fluoride|Calcite|||||||||130|70|30|mm|yellow|||3
109496|NEWHM : 2005.H2313|Natural Sciences|Earth Sciences|Mineralogy|1|mineral||Mineral specimen of Baryte. Collected from unspecified rocks.||Baryte|25.4.17|sulphate||||||||||160|150|100|mm||||2
109501|NEWHM : 2005.H2340|Natural Sciences|Earth Sciences|Mineralogy|1|mineral||Mineral specimen of Galena. Collected from unspecified rocks from Muggleswick Common, Keilder, Northumberland (NE England). Collected by Brian Young, 1994.||Galena|3.6.5|sulphide||||Young, Brian|1994|UK, England, Northumberland (NE England), Kielder, Muggleswick Common|Muggleswick Common||||||||||2
109505|NEWHM : 2005.H2346|Natural Sciences|Earth Sciences|Mineralogy|1|mineral|Eilat Stone|Mineral specimen of Chrysocolla. Collected from unspecified rocks from King Solomon's Copper Mines, Timna, Israel. Collected by Mrs Todd. This material is also known as Eilat Stone, consisting of a mixture of copper minerals.||Chrysocolla|14.2.5|silicate||||Todd, Mrs||Israel, Timna, King Solomon's Copper Mines|||||||||||5
109507|NEWHM : 2005.H2348|Natural Sciences|Earth Sciences|Mineralogy|1|mineral||Mineral specimen of the Tourmaline group (?). Collected from unspecified rocks. Collected by William Hutton.||Tourmaline group (?)|17.5.43|silicate||||Hutton, William||||gemstone (rectangular, faceted)||||||pink|||1
109515|NEWHM : 2006.H2541|Natural Sciences|Earth Sciences|Mineralogy|1|mineral||Mineral specimen of Talc. Collected from USSR (?).||Talc|14.04.09|silicate||||||U.S.S.R. (?)|||70|160|140||cm||||1
109517|NEWHM : 2006.H2543|Natural Sciences|Earth Sciences|Mineralogy|1|mineral||Mineral specimen of Phoenicochroite. Collected from USSR (?).||Phoenicochroite|27.02.06|chromate||||||U.S.S.R. (?)|||65|180|120||cm||||3
