irn|ColObjectNumber|ColDepartment|ColCollection|ColSubCollection|ColCompleteNotes|SpeNumberSpecimens|ClaObjectName_tab|ColOtherName|ExhTitle|ColPhysicalDescription|NarNarrative|ComName_tab|SciName|ColSum|ColCollectionDates|LocalSum|SpeNumberMale|SpeNumberFemale|SpeAge|SpePhase|SpeForm|PrepBy|SpeDatePrepared|DimLength|DimLengthUnit|DimWeightUnit|PhyColourPart|PhyColour|MulDescription|NumMulFiles
135698|NEWHM : HANM.4.1188|Natural Sciences|Vertebrate Zoology|Reptiles|||reptile mount|Cobra||Mount of a Cobra||Cobra|Chordata & Reptilia & Squamata & Elapidae : : : : Chordata|||||||||||||||||14
136125|NEWHM : HANM.4.1616|Natural Sciences|Vertebrate Zoology|Reptiles|||reptile mount|Gharial||Mount of a gharial/gavial||Gharial|Chordata & Reptilia & Crocodilia & Gavialidae : : : : Chordata|||||||||||||||||15
136564|NEWHM : HANM.4.2661|Natural Sciences|Vertebrate Zoology|Reptiles||1|reptile mount|Nile Crocodile||Mount of a Nile Crocodile||Nile Crocodile|Chordata & Reptilia & Crocodilia & Crocodylidae : : : : Chordata|||||||||||||||||14
188578|NEWHM : M1109|Natural Sciences|Vertebrate Zoology|Reptiles||1|reptile skin|Common African Python||Skin of a Common African Python||Common African Python|Chordata & Mammalia & & Pythonidia : : : : Chordata||||||||skin|||||||||1
200823|NEWHM : 1994.H1|Natural Sciences|Vertebrate Zoology|Reptiles||1|reptile vertebrate|reptile||Skull and feet and tail.||Horned 'Toad' Lizard|Chordata & Reptilia & Squamata & Iguanidae : : : : Chordata||||||adult|||||13.5|cm|||||1
200824|NEWHM : 1994.H2|Natural Sciences|Vertebrate Zoology|Reptiles||1|reptile vertebrate|reptile||Skeleton no skull and trachea.||Crocodile|Chordata & Reptilia & Crocodilia & Crocodylidae : : : : Chordata|||captivity||||||||56|cm|||||1
200825|NEWHM : 1994.H3|Natural Sciences|Vertebrate Zoology|Reptiles||1|reptile vertebrate|reptile||Skeleton and scales.||Spur-thighed Tortoise|Chordata & Reptilia & Chelonia & Testudinidae : : : : Chordata|||captivity|1||18 months|||||12.5|cm|||||1
200826|NEWHM : 1994.H4|Natural Sciences|Vertebrate Zoology|Reptiles||1|reptile vertebrate|reptile||Skeleton and horny shell.||Tortoise|Chordata & Reptilia & Chelonia & Testudinidae : : : : Chordata|||captivity|1||6 months|||||7.25|cm|||||1
200872|NEWHM : 1995.H111|Natural Sciences|Vertebrate Zoology|Reptiles||1|reptile vertebrate|reptile||Carapace (with horny scutes).||Green Turtle|Chordata & Reptilia & Chelonia & Cheloniidae : : : : Chordata|||||||||||54.5|cm|||||1
200951|NEWHM : 1997.H162|Natural Sciences|Vertebrate Zoology|Reptiles||1|reptile vertebrate|reptile||Skull no mandible (40 tooth sockets, missing all but 2 teeth, both broken), in 14 pieces.||American Crocodile|Chordata & Reptilia & Crocodilia & Crocodylidae : : : : Chordata||||||adult|||||56|cm|||||1
200952|NEWHM : 1997.H163|Natural Sciences|Vertebrate Zoology|Reptiles||1|reptile vertebrate|reptile||Skull, sagittally sectioned, left half only (29 tooth sockets, 2 teeth remaining).||Gharial|Chordata & Reptilia & Crocodilia & Gavialidae : : : : Chordata||||||adult|||||84|cm|||||1
200954|NEWHM : 1997.H165|Natural Sciences|Vertebrate Zoology|Reptiles||1|reptile vertebrate|reptile||Skeleton part, no skull (includes carapace, plastron and 14 other bones).||Tortoise|Chordata & Reptilia & Chelonia & Testudinidae : : : : Chordata|||captivity|||adult (from size)|||||20|cm|||||1
200955|NEWHM : 1997.H166|Natural Sciences|Vertebrate Zoology|Reptiles||1|reptile vertebrate|reptile||Skeleton nearly complete.||Tortoise|Chordata & Reptilia & Chelonia & Testudinidae : : : : Chordata|||captivity|||||||||cm|||||1
201040|NEWHM : 1999.H2019|Natural Sciences|Vertebrate Zoology|Reptiles||1|reptile egg|Snake||Egg from a Snake, broken.||Snake|Chordata & Reptilia & Squamata & sub-order Ophidia : : : : Chordata|||||||||||7.7|cm|||||1
201042|NEWHM : 2000.H1351|Natural Sciences|Vertebrate Zoology|Reptiles||1|reptile vertebrate|reptile, reptile||Skull disarticulated.||Bosc's|Chordata & Reptilia & Squamata & Varanidae : : : : Chordata|||||||||||||||||1
201043|NEWHM : 2000.H1352|Natural Sciences|Vertebrate Zoology|Reptiles||1|reptile vertebrate|reptile, reptile||Skull.||Nile Monitor|Chordata & Reptilia & Squamata & Varanidae : : : : Chordata|||||||||||||||||1
201044|NEWHM : 2000.H1353|Natural Sciences|Vertebrate Zoology|Reptiles||1|reptile vertebrate|reptile||Skull.||Gabon Viper|Chordata & Reptilia & Squamata & Viperidae : : : : Chordata|Gerrard's||Africa||||||||7|cm|||||1
201049|NEWHM : 2000.H1358|Natural Sciences|Vertebrate Zoology|Reptiles||1|reptile vertebrate|reptile||Skull, disarticulated.||West African Crocodile|Chordata & Reptilia & Crocodilia & Crocodylidae : : : : Chordata|||West Africa||||||||15.9|cm|||||1
201050|NEWHM : 2000.H1359|Natural Sciences|Vertebrate Zoology|Reptiles||1|reptile vertebrate|reptile||Skull, disarticulated.||West African Crocodile|Chordata & Reptilia & Crocodilia & Crocodylidae : : : : Chordata|||West African Coast||||||||25.6|cm|||||1
201051|NEWHM : 2000.H1360|Natural Sciences|Vertebrate Zoology|Reptiles|missing parts of limbs and tail|1|reptile vertebrate|reptile||Skeleton.||Alligator|Chordata & Reptilia & Crocodilia & Crocodylidae : : : : Chordata|||North America, USA|||3 years|||||22.5|cm|||||1
201707|NEWHM : S0506|Natural Sciences|Vertebrate Zoology|Reptiles||1|reptile vertebrate|reptile||Carapace and plastron.|Box Tortoises have a hinged lower shell to give the animal more space, allowing both head and forelimbs to stretch out when feeding while still being able to close up tightly when needed. The first picture gives an idea of the very large aperture when the lid is open, and number three shows how tightly the box can close.|Carolina Box Tortoise|Chordata & Reptilia & Chelonia & Emydidae : : : : Chordata|||||||||||12|cm|||||2
201708|NEWHM : S0507|Natural Sciences|Vertebrate Zoology|Reptiles||1|reptile vertebrate|reptile, reptile||Carapace.|This tortoise is the same variety as in record S0506, but picture 2 shows the very intricate shell pattern that the younger ones sometimes have. Picture 1 gives an idea of the unusual shape of the upper shell where the lid fits in.|Carolina Box Tortoise|Chordata & Reptilia & Chelonia & Emydidae : : : : Chordata|||||||||||14.5|cm|||||1
201719|NEWHM : S0518|Natural Sciences|Vertebrate Zoology|Reptiles||1|reptile vertebrate|reptile||Skull.|This large tortoise is a smaller variety than the enormous Galapagos tortoises. The largest specimens are about 50=60cm (20=24ins) long. Land tortoises are vegetarians and live in the tropics where there is plenty of growth at ground level to feed on. As you can see, tortoises have no teeth, and use their sharp horny beak to cut grass or leaves which they swallow whole. Different races live in different parts of the world and sometimes on different islands. This skull may have been from the same specimen as record number S0520.|Land Tortoise (English name not found)|Chordata & Reptilia & Chelonia & Testudinidae : : : : Chordata|||Indian Ocean (an unnamed island)||||||||10.5|cm|||||1
201721|NEWHM : S0520|Natural Sciences|Vertebrate Zoology|Reptiles||1|reptile vertebrate|reptile||Carapace and plastron.|This large tortoise was the property of John Hancock, and may even be part of the same animal as specimen number S0518. The red marks on the top of the shell outline one of the shell bones, and the larger blue ones outline the position of the horny, or tortoishell scales, which have been removed. As you can see they are different sizes and in different places. The view of the under shell, or plastron, shows where the shell was cut away to remove the rest of the bones, and how it was wired back together afterwards. It also shows John Hancock's initials, which he used to write on his own specimens.|Tortoise|Chordata & Reptilia & Chelonia & Testudinidae : : : : Chordata|||||||||||34|cm|||||1
201723|NEWHM : S0522|Natural Sciences|Vertebrate Zoology|Reptiles||1|reptile vertebrate|reptile, reptile||Carapace, dried and plastron, dried.|"This turtle was collected by John Bartram in 1765 when exploring the Ohio River. He probably sent it to Marmaduke Tunstall whose Museum eventually came to be one of the very early acquisitions of the ""Newcastle Museum"" in 1822 (before its name was changed to the ""Hancock Museum""). It is one of the oldest dated specimens in the Museum. Soft-shelled Turtles are covered with tough skin, often with some horny scales on the limbs. They also have spine-like tubes around the front edge of their shells. They are a fresh water species, only found in North America."|Spiny Soft-shelled Turtle|Chordata & Reptilia & Chelonia & Trionychidae : : : : Chordata||1765|North America, Ohio River|||immature|||||15.4|cm|||||1
201726|NEWHM : S0525|Natural Sciences|Vertebrate Zoology|Reptiles||1|reptile vertebrate|reptile, reptile||Skeleton missing one foot.|This Chameleon skeleton had been partially cleaned by insects when it was found. The small teeth teeth are used for gripping the insects caught by the long sticky tongue. At the back of the skull are the remains of the casque which gives Chameleons their distinctive outline.|Chameleon|Chordata & Reptilia & Squamata & Chameleonidae : : : : Chordata|||||||||||9.5|cm|||||1
201728|NEWHM : S0527|Natural Sciences|Vertebrate Zoology|Reptiles||1|reptile vertebrate|reptile, reptile||Skull no left quadrate, mandible in two halves.|This is one of the large monitor lizards. The largest monitor, the Kemodo Dragon, can be dangerous to humans. They are all carnivorous, and as the picture shows, there are only a few sharp teeth at the front of the mouth for grasping prey and some very tough rounded ones at the back for crushing. These lizards swallow their food whole, or in pieces, and all the digesting is done in their internal organs. This is an Old World group which is not found in the UK.|Bosc's|Chordata & Reptilia & Squamata & Varanidae : : : : Chordata||1831|Africa, Zimbabwe||||||||11.6|cm|||||1
201735|NEWHM : S0534|Natural Sciences|Vertebrate Zoology|Reptiles||2|reptile vertebrate|reptile, reptile||Rattlesnakes, 2.|These are rattles from the ends of the tails of two Rattlesnakes. The rattles are composed of the cast of the snake's skin which is carried at the end of the tail. When shaken it makes quite a lot of noise. One use suggested for it is to warn large animals that they might tread on it. Rattlesnakes are only found in the New World (South and North America).|Rattlesnake|Chordata & Reptilia & Squamata & Viperidae : : : : Chordata|||||||||||6.3|cm|||||1
201740|NEWHM : S0539|Natural Sciences|Vertebrate Zoology|Reptiles||1|reptile vertebrate|reptile||Skull 9 teeth missing.|This rare Crocodile inhabits a part of the world where alligators are more common than crocodiles; the main characteristic of crocodiles' skulls can be seen in this side view, where the fourth tooth from the front of the lower jaw fits into a notch outside the upper jaw, unlike alligators, in which this tooth fits into a notch in the jawbone itself.|Cuban Crocodile|Chordata & Reptilia & Crocodilia & Crocodylidae : : : : Chordata|||West Indies, Cuba||||||||30|cm|||||1
201742|NEWHM : S0541|Natural Sciences|Vertebrate Zoology|Reptiles|several teeth missing|1|reptile vertebrate|reptile||Skull missing most of teeth, plus loose teeth and quadrate pieces.|The long, slender jaws of the Gharial, with two rows of pointed teeth, are typical of fish eating animals. Gharials are found only in the estuaries of the larger rivers of India and Burma. Unfortunately in our picture the upper and lower jaws are not quite aligned, so the teeth can't be seen locking together as they do in life.|Gharial|Chordata & Reptilia & Crocodilia & Gavialidae : : : : Chordata|Gladstone, S.|||||adult|||||||||||1
201945|NEWHM : S0744|Natural Sciences|Vertebrate Zoology|Reptiles||1|reptile vertebrate|reptile||Plastron, right half.|This bone lies beneath the turtle's body. It is covered by the outer tortoiseshell plates. As you look at the picture, the turtle's head would be to the left, its tail to the right and it would be lying on its front, on top of these bones. Sea turtles have no need of solid bony shells as land tortoises do, because the water supports their bodies.|Green Turtle|Chordata & Reptilia & Chelonia & Cheloniidae : : : : Chordata|||Borneo||||||||36|cm|||||1
201947|NEWHM : S0746|Natural Sciences|Vertebrate Zoology|Reptiles||1|reptile vertebrate|reptile||Skull (in mounted skin). Mounted for display.||Cobra|Chordata & Reptilia & Squamata & Elapidae : : : : Chordata|||||||||||||||||1
201948|NEWHM : S0747|Natural Sciences|Vertebrate Zoology|Reptiles||1|reptile vertebrate|reptile ||Skeleton. About the size of an adder, Viper berus.|This skeleton has no information with it. If it comes from Britain it is probably an Adder. The bones are old and dirty, so that it is difficult to make out details in the picture, but the skull, at the left hand end, is definitely of one of the poisonous snakes in the Viper family.|Poisonous Snake|Chordata & Reptilia & Squamata & Viperidae : : : : Chordata|||||||||||57|cm|||||3
202349|NEWHM : S1149|Natural Sciences|Vertebrate Zoology|Reptiles||1|reptile vertebrate|reptile||Skeleton no skull, missing left side limbs.||Tortoise|Chordata & Reptilia & Chelonia & Testudinidae : : : : Chordata|||||||||||7.1|cm|||||1
202350|NEWHM : S1150|Natural Sciences|Vertebrate Zoology|Reptiles||1|reptile egg|Tortoise||Four large and two small eggs from a Tortoise||Tortoise|Chordata & Reptilia & Chelonia & Testudinidae : : : : Chordata|||captivity|||||||||cm|||||1
202352|NEWHM : S1152|Natural Sciences|Vertebrate Zoology|Reptiles||1|reptile vertebrate|Snake||Skeleton (skull disarticulated) and skin (part).||Grass Snake|Chordata & Reptilia & Squamata & Colubridae : : : : Chordata|||UK, England, Tyne and Wear, Newcastle upon Tyne, Heaton|||adult|||||60|cm|||||1
202498|NEWHM : S1298|Natural Sciences|Vertebrate Zoology|Reptiles||1|reptile vertebrate|reptile, reptile||Skeleton.||Green Anole|Chordata & Reptilia & Squamata & Iguanidae : : : : Chordata|||captivity||||||||||||||1
202499|NEWHM : S1299|Natural Sciences|Vertebrate Zoology|Reptiles||1|reptile vertebrate|reptile||Skeleton (missing parts of hind legs and tail).||Hermann's Tortoise|Chordata & Reptilia & Chelonia & Testudinidae : : : : Chordata|||captivity|||adult (possibly)|||||15|cm|||||1
202500|NEWHM : S1300|Natural Sciences|Vertebrate Zoology|Reptiles||1|reptile vertebrate|reptile||Skeleton (some smaller bones may be missing).||Tortoise|Chordata & Reptilia & Chelonia & Testudinidae : : : : Chordata|||captivity|||adult (possibly)|||||14.5|cm|||||1
202571|NEWHM : S1371|Natural Sciences|Vertebrate Zoology|Reptiles||1|reptile vertebrate|reptile, reptile||Skeleton missing some vertebrae and most of carapace.|The picture shows the turtle's skull. In life the animal was protected by a covering of tiny bones, all locked together, beneath a tough leathery skin. The Leathery Turtle is the largest variety of the sea turtle group. This one was nine feet wide from flipper to flipper.|Leathery Turtle, Luth|Chordata & Reptilia & Testudines & Dermochelydae : : : : Chordata|Nesbitt, I.|15/09/1990|UK, England, Northumberland (NE England), Blyth (off the coast)||1|adult|||||155|cm| 'kg||||1
202572|NEWHM : S1372|Natural Sciences|Vertebrate Zoology|Reptiles||1|reptile vertebrate|reptile, reptile||Carapace pieces (43 bones from carapace).||Leathery Turtle, Luth|Chordata & Reptilia & Chelonia & Dermochelydae : : : : Chordata|Brown, J.|23/10/1990|UK, England, Northumberland (NE England), Alnmouth|1||adult|||||159|cm|||||1
202574|NEWHM : S1374|Natural Sciences|Vertebrate Zoology|Reptiles||1|reptile vertebrate|reptile||Skull.||Lizard|Chordata & Reptilia & Squamata & Lacertidae : : : : Chordata|||||||||||2.5|cm|||||1
202575|NEWHM : S1375|Natural Sciences|Vertebrate Zoology|Reptiles||1|reptile vertebrate|Lizard, Lizard||Skeleton.||Turkish Gecko|Chordata & Reptilia & Squamata & Gekkonidae : : : : Chordata|||captivity|||adult|||||||||||1
202639|NEWHM : S1439|Natural Sciences|Vertebrate Zoology|Reptiles||1|reptile vertebrate|reptile||Skull (38 teeth present; 160 sockets).||Gharial|Chordata & Reptilia & Crocodilia & Gavialidae : : : : Chordata|||||||||||||||||1
202979|NEWHM : 2009.H664|Natural Sciences|Vertebrate Zoology|Reptiles||1|reptile spirit specimen|Snake||Snake preserved in spirit.||Snake| : : : :||||||||spirit|||||||||1
203017|NEWHM : 2009.H702|Natural Sciences|Vertebrate Zoology|Reptiles||1|reptile spirit specimen|European Pond Tortoise||European pond tortoise preserved in spirit.||European Pond Tortoise|emys orbicularis : : : :||||||||spirit|||||||||1
203069|NEWHM : 2009.H754|Natural Sciences|Vertebrate Zoology|Reptiles||2|reptile spirit specimen|Green Lizard||Green lizard x2 preserved in spirit.||Lizard| : : : :||||||||spirit|||||||||1
203072|NEWHM : 2009.H757|Natural Sciences|Vertebrate Zoology|Reptiles||1|reptile spirit specimen|Horned Lizard||Horned lizard preserved in spirit.||Lizard| : : : :||||||||spirit|||||||||1
203087|NEWHM : 2009.H772|Natural Sciences|Vertebrate Zoology|Reptiles||1|reptile spirit specimen|Snake||Unidentified Snake preserved in spirit.||Snake| : : : :||||||||spirit|||||||||1
203088|NEWHM : 2009.H773|Natural Sciences|Vertebrate Zoology|Reptiles||1|reptile spirit specimen|Snake||Unidentified Snake preserved in spirit.||Snake| : : : :||||||||spirit|||||||||1
203154|NEWHM : 2009.H839|Natural Sciences|Vertebrate Zoology|Reptiles||1|reptile spirit specimen|unidentified specimen||Unidentified reptile preserved in spirit.||Unidentified species| : : : :||||||||spirit|||||||||1
203175|NEWHM : 2009.H860|Natural Sciences|Vertebrate Zoology|Reptiles||1|reptile spirit specimen|Gecko, Gecko||Gecko virticulatus preserved in spirit.||Gecko|gecko virticulatus : : : :||||||||spirit|||||||||1
203236|NEWHM : 2009.H921|Natural Sciences|Vertebrate Zoology|Reptiles|||reptile spirit specimen|Snake||Snakes preserved in spirit.||Snake| : : : :||||||||spirit|||||||||1
203390|NEWHM : 2009.H1075|Natural Sciences|Vertebrate Zoology|Reptiles||1|reptile spirit specimen|Green Lizard||Green Lizard preserved in spirit.||Green Lizard| : : : :||||||||spirit|||||||||1
203393|NEWHM : 2009.H1078|Natural Sciences|Vertebrate Zoology|Reptiles||1|reptile spirit specimen|Lizard (?)||Unidentified Lizard preserved in spirit.|||||||||||spirit|||||||||1
203394|NEWHM : 2009.H1079|Natural Sciences|Vertebrate Zoology|Reptiles||1|reptile spirit specimen|Chameleon||Chameleon preserved in spirit.||Chameleon| : : : :||||||||spirit|||||||||1
203397|NEWHM : 2009.H1082|Natural Sciences|Vertebrate Zoology|Reptiles||1|reptile spirit specimen|Gecko||Gecko preserved in spirit.||Gecko|gecko virticulatus : : : :||||||||spirit|||||||||1
203398|NEWHM : 2009.H1083|Natural Sciences|Vertebrate Zoology|Reptiles||1|reptile spirit specimen|Snake||Snake (unidentified) preserved in spirit.||Snake| : : : :||||||||spirit|||||||||1
203432|NEWHM : 2009.H1117|Natural Sciences|Vertebrate Zoology|Reptiles||2|reptile spirit specimen|Snake||Unidentified snake preserved in spirit.||Snake| : : : :||||||||spirit|||||||||1
203435|NEWHM : 2009.H1121|Natural Sciences|Vertebrate Zoology|Reptiles||1|reptile spirit specimen|Grass Snake||Grass Snake preserved in spirit.||Grass Snake| : : : :||||||||spirit|||||||||1
203450|NEWHM : 2009.H1136|Natural Sciences|Vertebrate Zoology|Reptiles||3|reptile spirit specimen|Snake (?)||Unidentified Snakes x3 preserved in spirit.||Snake| : : : :||||||||spirit|||||||||1
203458|NEWHM : 2009.H1144|Natural Sciences|Vertebrate Zoology|Reptiles||1|reptile spirit specimen|Chameleon||Chameleon preserved in spirit.||Chameleon| : : : :||||||||spirit|||||||||1
203462|NEWHM : 2009.H1148|Natural Sciences|Vertebrate Zoology|Reptiles||1|reptile spirit specimen|Lizard||Unidentified Lizard preserved in spirit.||Lizard| : : : :||||||||spirit|||||||||1
203476|NEWHM : 2009.H1162|Natural Sciences|Vertebrate Zoology|Reptiles||1|reptile spirit specimen|Snake||Snake preserved in spirit.||Snake| : : : :||||||||spirit|||||||||1
203481|NEWHM : 2009.H1167|Natural Sciences|Vertebrate Zoology|Reptiles||1|reptile spirit specimen|Snake||Snakes head preserved in spirit.||Snake (head)| : : : :||||||||spirit|||||||||1
203490|NEWHM : 2009.H1176|Natural Sciences|Vertebrate Zoology|Reptiles||1|reptile spirit specimen|unidentified species||Unidentified species (possibly reptilion) preserved in spirit.|||||||||||spirit|||||||||1
203502|NEWHM : 2009.H1188|Natural Sciences|Vertebrate Zoology|Reptiles||1|reptile spirit specimen|||Lacerta muralis preserved in spirit.|||lacerta muralis : : : :||||||||spirit|||||||||1
203525|NEWHM : 2009.H1211|Natural Sciences|Vertebrate Zoology|Reptiles|||reptile spirit specimen|Snake||Snake preserved in spirit||Snake| : : : :||||||||spirit|||||||||1
203565|NEWHM : 2009.H1251|Natural Sciences|Vertebrate Zoology|Reptiles||1|reptile spirit specimen|Lizard||Lizard, preserved in spirit.||Lizard| : : : :||||||||spirit|||||||||1
203569|NEWHM : 2009.H1255|Natural Sciences|Vertebrate Zoology|Reptiles||1|reptile spirit specimen|Lizard||Lizard, preserved in spirit.||Lizard| : : : :||||||||spirit|||||||||1
203584|NEWHM : 2009.H1270|Natural Sciences|Vertebrate Zoology|Reptiles||1|reptile spirit specimen|Snake||Snake, preserved in spirit.||Snake| : : : :||||||||spirit|||||||||1
203588|NEWHM : 2009.H1274|Natural Sciences|Vertebrate Zoology|Reptiles||1|reptile spirit specimen|Snake||Snake, preserved in spirit.||Snake| : : : :||||||||spirit|||||||||1
203590|NEWHM : 2009.H1276|Natural Sciences|Vertebrate Zoology|Reptiles||1|reptile spirit specimen|Lizard||Lizard, preserved in spirit.||Lizard| : : : :||||||||spirit|||||||||1
203607|NEWHM : 2009.H1293|Natural Sciences|Vertebrate Zoology|Reptiles||1|reptile spirit specimen|Iguana||Iguana, preserved in spirit.||Iguana| : : : :||||||||spirit|||||||||1
203625|NEWHM : 2009.H1311|Natural Sciences|Vertebrate Zoology|Reptiles|||reptile spirit specimen|||Picanthosaura minor, preserved in spirit.|||picanthosaura minor : : : :||||||||spirit|||||||||1
203626|NEWHM : 2009.H1312|Natural Sciences|Vertebrate Zoology|Reptiles|||reptile spirit specimen|Chameleon||Chameleon, preserved in spirit.||Chameleon| : : : :||||||||spirit|||||||||1
203627|NEWHM : 2009.H1313|Natural Sciences|Vertebrate Zoology|Reptiles|||reptile spirit specimen|Lizard||Lizard, preserved in spirit.||Lizard| : : : :||||||||spirit|||||||||1
203651|NEWHM : 2009.H1337|Natural Sciences|Vertebrate Zoology|Reptiles||1|reptile spirit specimen|Snake||Snake preserved in spirit||Snake| : : : :||||||||spirit|||||||||1
203666|NEWHM : 2009.H1352|Natural Sciences|Vertebrate Zoology|Reptiles||1|reptile spirit specimen|Snake||Snake eating something, preserved in spirit.||Snake| : : : :||||||||spirit|||||||||1
203669|NEWHM : 2009.H1355|Natural Sciences|Vertebrate Zoology|Reptiles||1|reptile spirit specimen|Snake||Unidentified snake, preserved in spirit.||Snake| : : : :||||||||spirit|||||||||1
203688|NEWHM : 2009.H1374|Natural Sciences|Vertebrate Zoology|Reptiles||1|reptile spirit specimen|Snake||Unidentified snake, preserved in spirit.||Snake| : : : :||||||||spirit|||||||||1
203733|NEWHM : 2009.H1419|Natural Sciences|Vertebrate Zoology|Reptiles||1|reptile spirit specimen|Snake||Snake preserved in spirit.||Snake| : : : :||||||||spirit|||||||||1
203734|NEWHM : 2009.H1420|Natural Sciences|Vertebrate Zoology|Reptiles||1|reptile spirit specimen|Snake||Snake preserved in spirit.||Snake| : : : :||||||||spirit|||||||||1
203743|NEWHM : 2009.H1429|Natural Sciences|Vertebrate Zoology|Reptiles||1|reptile spirit specimen|Snake||Unidentified snake, preserved in spirit.||Snake| : : : :||||||||spirit|||||||||1
203751|NEWHM : 2009.H1437|Natural Sciences|Vertebrate Zoology|Reptiles||1|bird egg spirit specimen, reptile spirit specimen, mammal|Snake||Snake, bat, unidentified small mammal (possible embryo), and several bird eggs complete with embryo's, preserved in spirit.||Bat| : : : :||||||embryo||spirit|||||||||1
203762|NEWHM : 2009.H1448|Natural Sciences|Vertebrate Zoology|Reptiles||1|reptile spirit specimen|Snake||Snake, preserved in spirit.||Snake| : : : :||||||||spirit|||||||||1
203765|NEWHM : 2009.H1451|Natural Sciences|Vertebrate Zoology|Reptiles||2|reptile spirit specimen|Chameleon||Chameleon, preserved in spirit.||Chameleon| : : : :||||||||spirit|||||||||1
203780|NEWHM : 2009.H1466|Natural Sciences|Vertebrate Zoology|Reptiles||1|reptile spirit specimen|Snake||Snake preserved in spirit.||Snake| : : : :||||||||spirit|||||||||1
203785|NEWHM : 2009.H1471|Natural Sciences|Vertebrate Zoology|Reptiles||1|reptile spirit specimen|Snake||Snake preserved in spirit.||Snake| : : : :||||||||spirit|||||||||1
203789|NEWHM : 2009.H1475|Natural Sciences|Vertebrate Zoology|Reptiles||1|reptile spirit specimen|Snake||Snake preserved in spirit||Snake| : : : :||||||||spirit|||||||||1
203791|NEWHM : 2009.H1477|Natural Sciences|Vertebrate Zoology|Reptiles|||reptile spirit specimen|Snake||Snake preserved in spirit||Snake| : : : :||||||||spirit|||||||||1
203794|NEWHM : 2009.H1480|Natural Sciences|Vertebrate Zoology|Reptiles||1|reptile spirit specimen|Snake||Snake preserved in spirit.||Snake| : : : :||||||||spirit|||||||||1
203795|NEWHM : 2009.H1481|Natural Sciences|Vertebrate Zoology|Reptiles||1|reptile spirit specimen|Snake||Snake, preserved in spirit.||Snake| : : : :||||||||spirit|||||||||1
203856|NEWHM : 2009.H1542|Natural Sciences|Vertebrate Zoology|Reptiles||1|reptile spirit specimen|Gecko||Gecko and skink embryo's (in test tubes) preserved in spirit.||Gecko|gecko virticulatus : : : :||||||embryo||spirit|||||||||1
203879|NEWHM : 2009.H1565|Natural Sciences|Vertebrate Zoology|Reptiles||1|reptile spirit specimen|Salamander||Salmander tails preserved in spirit.||Salmander| : : : :||||||||spirit|||||||||1
203885|NEWHM : 2009.H1571|Natural Sciences|Vertebrate Zoology|Reptiles||1|reptile spirit specimen|Common Lizard||Common Lizard preserved in spirit.||Common Lizard| : : : :||||||||spirit|||||||||1
