irn|ColObjectNumber|ColDepartment|ColCollection|ColSubCollection|ColCompleteNotes|SpeNumberSpecimens|ClaObjectName_tab|ColOtherName|ExhTitle|ColPhysicalDescription|NarNarrative|ComName_tab|SciName|ColSum|ColCollectionDates|LocalSum|SpeNumberMale|SpeNumberFemale|SpeAge|SpePhase|SpeForm|PrepBy|SpeDatePrepared|DimLength|DimLengthUnit|DimWeightUnit|PhyColourPart|PhyColour|MulDescription|NumMulFiles
203976|NEWHM : 2009.H1662|Natural Sciences|Vertebrate Zoology|Reptiles||1|reptile spirit specimen|Gecko||Gecko embyo's preserved in spirit.||Gecko|gecko virticulatus : : : :||||||||spirit|||||||||1
203977|NEWHM : 2009.H1663|Natural Sciences|Vertebrate Zoology|Reptiles||1|reptile spirit specimen|Lizard||Lizard preserved in spirit.||Lizard| : : : :||||||||spirit|||||||||1
204006|NEWHM : 2009.H1692|Natural Sciences|Vertebrate Zoology|Reptiles||1|reptile spirit specimen|Grass Snake||Grass Snake preserved in spirit.||Grass Snake| : : : :||||||||spirit|||||||||1
204007|NEWHM : 2009.H1693|Natural Sciences|Vertebrate Zoology|Reptiles||1|reptile spirit specimen|Lizard (?)||Unidentified lizard preserved in spirit.||Lizard| : : : :||||||||spirit|||||||||1
204012|NEWHM : 2009.H1698|Natural Sciences|Vertebrate Zoology|Reptiles||1|reptile spirit specimen|Grass Snake||Grass Snake with bits preserved in spirit.||Grass Snake| : : : :||||||||spirit|||||||||1
204016|NEWHM : 2009.H1702|Natural Sciences|Vertebrate Zoology|Reptiles||1|reptile spirit specimen|Nile Crocodile||Crocodilius niloticus embyos preserved in spirit.||Nile Crocodile|crocodilius niloticus embyos : : : :||||||embryo||spirit|||||||||1
204022|NEWHM : 2009.H1708|Natural Sciences|Vertebrate Zoology|Reptiles||1|reptile spirit specimen|Lizard||Lizard preserved in spirit.||Lizard| : : : :||||||||spirit|||||||||1
204023|NEWHM : 2009.H1709|Natural Sciences|Vertebrate Zoology|Reptiles||1|reptile spirit specimen|Lizard||Lizard preserved in spirit.||Lizard| : : : :||||||||spirit|||||||||1
204030|NEWHM : 2009.H1716|Natural Sciences|Vertebrate Zoology|Reptiles||1|reptile spirit specimen|Snake||Snake preserved in spirit.||Snake| : : : :||||||||spirit|||||||||1
204037|NEWHM : 2009.H1723|Natural Sciences|Vertebrate Zoology|Reptiles||1|reptile spirit specimen|Red-eared Terrapin||Red-eared Terrapin preserved in spirit.||Red-eared Terrapin| : : : :||||||||spirit|||||||||1
204224|NEWHM : 2009.H1910|Natural Sciences|Vertebrate Zoology|Reptiles||1|reptile spirit specimen|Snake||Snake (label unreadable) preserved in spirit.||Snake| : : : :||||||||spirit|||||||||1
204290|NEWHM : 2009.H1976|Natural Sciences|Vertebrate Zoology|Reptiles||1|reptile spirit specimen|||Lygosoma preserved in spirit.|||lygosoma : : : :||||||||spirit|||||||||1
204355|NEWHM : 2009.H2040|Natural Sciences|Vertebrate Zoology|Reptiles||3|reptile spirit specimen|Newt||Smooth Newts preserved in spirit.||Smooth Newt| : : : :||||||||spirit|||||||||1
204371|NEWHM : 2009.H2056|Natural Sciences|Vertebrate Zoology|Reptiles||2|reptile spirit specimen|Common Newt||Common Newt preserved in spirit.||Common Newt| : : : :||||||||spirit|||||||||1
204390|NEWHM : 2009.H2075|Natural Sciences|Vertebrate Zoology|Reptiles||1|reptile spirit specimen|Lizard||Lizard preserved in spirit.||Lizard| : : : :||||||||spirit|||||||||1
203705|NEWHM : 2009.H1391|Natural Sciences|Vertebrate Zoology|Reptiles||1|reptile spirit specimen|Chameleon||Chameleon with extended tongue, preserved in spirit.||Chameleon| : : : :||||||||spirit||||||||Chameleon specimen in the Spirit Store of the Great North Museum Resource Centre|2
530301|NEWHM : 2016.H4|Natural Sciences|Vertebrate Zoology|Reptiles||1|diorama, teeth|snake fangs, snake fangs||A historic glass fronted picture frame case containing a display on snake poison. It features three snake fangs in addition to handwritten text and hand drawn diagrams.||Snake|Serpentes : : Squamata : Reptilia : Chordata|||||||||||57|cm||||A historic cased display on snake venom., A historic cased display on snake venom.|2
